50697,"TÌNH KHÚC GIAO DUYÊN","Quê em vốn ở Đồng Nai...","Khánh Băng"
50696,"KHÚC TÌNH BUỒN","Lang thang chiều mưa hoang...","Nguyễn Ngọc Thạch"
50699,"TÌNH BỂ DÂU","Nàng bên tôi những đêm trăng tỏ...","Hoàng Phương"
50698,"XUÂN HỒNG TRÊN MÁ","Có một màu hồng...","Hoài Nam"
50693,"YÊU NGƯỜI XA XƯA","Người yêu ngày xa xưa đó...","Nhạc ngoại"
50692,"NHẬT KÝ ĐỜI TÔI","Ngược thời gian trở về quá khứ...","Thanh Sơn"
50695,"TÌNH ĐẦU","Khi ta nói yêu nhau lần đầu...","Nhạc: Hoàng Hiệp, Lời: Tôn Nữ Thanh Yên"
50694,"KHÚC NHẠC VUI","Bạn hãy cùng tôi ta về thăm phố xưa năm nào...","Nguyễn Ngọc Thiện"
50691,"KHÚC HÁT CHA YÊU","Nhiều năm trôi qua mau...","Nguyễn Hoài Anh"
50690,"HỌA MI TÓC NÂU","Họa mi hót giữa bầu trời xanh..","Trần Huân"
50675,"HỒN QUÊ","Em theo anh qua những cánh đồng...","Thanh Sơn"
50674,"MƯỜI NHỚ","Một tôi nhớ a ha đến người...","Dân ca"
50677,"CÔ THẮM VUI XUÂN","Ngày đầu một năm...","Vinh Sử"
50676,"BIẾT ƠN VÕ THỊ SÁU","Mùa hoa lê ki ma nở...","Nguyễn Đức Toàn"
50679,"ĐÔI LỜI","Em xin nghe anh nói...","Nhạc ngoại"
50678,"CUỘC TÌNH THỨ NHẤT","Cuộc tình thứ nhất đã cho ta...","Nhạc ngoại"
50671,"LỜI CA DÂNG BÁC","Ai yêu miền Nam như tấm lòng của Bác...","Trọng Loan"
50670,"LƯỢN TRÒN LƯỢN KHÉO","A chim bay chim bồ câu trắng...","Văn Chung"
50673,"LÝ MƯỜI THƯƠNG","Một thương tóc bỏ ngang vai...","Dân ca Miền Trung"
50672,"MỖI BƯỚC ĐI THÊM YÊU TỔ QUỐC","Trên quãng trường Ba Đình...","Tân Huyền"
50688,"THƯƠNG TIẾC","Ánh đèn vàng hiu hắt...","Nhạc ngoại"
50687,"NIỀM THƯƠNG NHỚ","Niềm thương nhớ em với anh còn đó...","Nhạc ngoại"
50686,"MƯA CHIỀU NHỚ NHAU","Chiều nay đi trong mưa thu...","Nguyễn Hữu Thiết"
50685,"EM THẤY GÌ QUA CƠN MƯA","Từng ngày qua trời nắng lên cao ...","Nhạc ngoại"
50689,"TRỞ VỀ MÁI NHÀ XƯA (COME BACK TO SORRENTO)","Watch the sea so bright and lovely...","Ernesto de Curtis"
50680,"HẬN TÌNH TRONG MƯA","Người tình đi xa tít...","Nhạc ngoại"
50684,"MƯA CHIỀU KỶ NIỆM","Chiều đông hiu hắt buồn...","Nhạc ngoại"
50683,"MƯA","Tiếng mưa rơi chiều nay...","Nhạc ngoại"
50682,"LỜI CUỐI CHO TÌNH YÊU","Chia tay xa nhau...","Nhạc Hoa"
50681,"KHI CÔ ĐƠN ANH GỌI TÊN EM","Nắng mai tràn về...","Nhạc Nhật"
50702,"NHÀNH CÂY TRỨNG CÁ","Bẻ một nhành cây nhành cây trứng cá...","Vinh Sử"
50703,"NỖI BUỒN BIỆT LY","Còn gì nữa đâu bao giờ gặp nhau...","Thanh Sơn"
50700,"NHỮNG DÒNG LƯU NIỆM","Thấm thoát một năm...","Hoài Nam"
50701,"THƯƠNG CA MÙA HẠ","Hè về rồi đây tâm hồn xuyến xao...","Thanh Sơn - Bảo Thu"
50706,"TÌNH YÊU LÀ THẾ","Tình yêu là ánh nắng...","Khánh Băng"
50707,"PHÙ SA NỒNG NÀN","Đồng lúa ngát xanh...","Trần Quang Huy"
50704,"TÌNH HỌC SINH","Tình học sinh ghi bằng...","Thanh Sơn"
50705,"TÌNH MƯA","Lắng nghe mưa rơi rơi...","Nhạc ngoại"
50708,"KIẾP PHONG BA","Một mai kia nếu xa nhau...","Nhạc Hoa, Lời Việt: Minh Khang"
50709,"RU ANH","Mẹ ru em thuở còn thơ...","Nhạc: Dzoãn Bình, Thơ: Lê Tú Lệ"
50710,"TÌNH EM ĐÃ CHẾT","Mưa rơi mưa rơi ướt mưa buồn...","Nguyễn Hữu Thiết"
50714,"THÀNH PHỐ CỎ NON","Cảm ơn chú bé đuổi dế ven đường...","Nguyễn Ngọc Thiện"
50713,"NGƯỜI MẸ CỦA TÔI","Nước mắt mẹ không còn...","Xuân Hồng"
50712,"NHỚ VỀ HÀ NỘI","Dù có đi bốn phương trời...","Hoàng Hiệp"
50711,"TỔ QUỐC MÀ KHÔNG CÓ","Đôi mắt không còn vẫn còn nghe tiếng hát...","Nhạc: Hoàng Hiệp, Lời: Mussa Batchaiev"
50715,"TIẾNG HÁT THÀNH PHỐ MANG TÊN NGƯỜI","Từ thành phố này...","Cao Việt Bách"
50716,"XUÂN CHIẾN KHU","Mùa xuân về trong chiến khu...","Xuân Hồng"
50717,"TÌNH CA ĐẤT NƯỚC","Rằng đã về ta cỏ cây sông núi ruộng đồng...","Phan Nhân"
50718,"VẾT CHÂN TRÒN TRÊN CÁT","Vết chân tròn vẫn đi về...","Trần Tiến"
50719,"TRỊ AN ÂM VANG MÙA XUÂN","Mỗi dòng nước trong...","Tôn Thất Lập"
50721,"VỀ THĂM MÁI TRƯỜNG XƯA","Về đây đứng bên mái trường xưa...","Trịnh Công Sơn"
50720,"NHƯ NHỮNG GIỌT SƯƠNG","Có những giọt sương trắng...","Nguyễn Văn Hiên"
50723,"TIẾNG HÁT NHỮNG ĐÊM KHÔNG NGỦ","Âm vang bao tiếng ca...","Phạm Tuyên"
50722,"TỰ NGUYỆN","Nếu là chim tôi sẽ là loài bồ câu trắng...","Trương Quốc Khánh"
50725,"VỀ GIỮA TRỊ AN","Về giữa mùa mưa ầm vang thác đổ...","Trịnh Công Sơn"
50724,"THÁNG NĂM HỌC TRÒ","Ngày xưa bé mới đến trường...","Nguyễn Đức Trung"
50728,"RỒI NHƯ ĐÁ NGÂY NGÔ","Đôi khi nắng qua mái hiên...","Trịnh Công Sơn"
50729,"LANG THANG INTERNET","Chiều lang thang internet...","Hoàng Huấn"
50726,"NỐI VÒNG TAY LỚN","Rừng núi dang tay...","Trịnh Công Sơn"
50727,"NGƯỜI VỀ BỖNG NHỚ","Mùa xuân yêu em đồi núi thênh thang...","Trịnh Công Sơn"
50736,"SẼ NÓI LỜI YÊU THƯƠNG TỚI NGƯỜI","Cứ muốn nói một lời...","Đoàn Xuân Mỹ"
50735,"TẶNG VẬT","Bình minh trên cánh đồng...","A Khuê"
50734,"VÀ TRONG GIÓ MÙA THU","Chiều tàn trong sương khói...","Đoàn Xuân Mỹ"
50733,"RỒI CÓ LẦN MƯA THAY LÁ ME","Rồi có lần mưa thay lá me...","Đoàn Xuân Mỹ"
50732,"TẠM BIỆT MÙA HÈ","Tạm biệt nhé những khung trời...","Đoàn Xuân Mỹ"
50731,"TRONG NỖI ĐAU TÌNH CỜ","Tôi đã yêu em bao ngày nắng...","Trịnh Công Sơn"
50730,"NHƯ MỘT LỜI CHIA TAY","Những hẹn hò từ nay...","Trịnh Công Sơn"
50737,"VẦNG DƯƠNG RẠNG RỠ","Chỉ vì em yêu anh...","Đoàn Xuân Mỹ"
50738,"THÁNG GIÊNG TRÊN NGÓN TAY NGOAN","Một ngọn nến thắp lên...","Đoàn Xuân Mỹ"
50739,"QUÊ HƯƠNG THƯƠNG NHỚ","Dù khi con ở đâu...","Mai Nguyên Vũ"
50745,"TIỄN BIỆT","Ở nơi nào cũng nhớ về quê hương...","Tô Thanh Tùng"
50744,"NỖI BUỒN CHƯA QUÊN","Em ngồi ru buổi chiều...","Hoàng Xuân Giang"
50747,"TIỄN EM NƠI PHI TRƯỜNG","Từ nay cách xa nghìn trùng...","Nhạc Pháp"
50746,"YÊU EM MỘT ĐỜI","Trời hôm nay mây thấp...","Nhạc ngoại"
50741,"TRĂNG MỜ BÊN SUỐI","Người hẹn cùng ta...","Lê Mộng Nguyên"
50740,"LAO XAO MÙA XUÂN","Gió ấm mùa đông lao xao, chào mùa xuân sắp sang...","Tiến Luân"
50743,"TÌNH ĐẸP MÙA CHÔM CHÔM","Nhớ mùa chôm chôm trước...","Vinh Sử"
50742,"NÓI CHI ĐẾN CHUYỆN MAI SAU","Đừng nói chi nhiều...","Thông Đạt"
50749,"TÔI NÓI ĐÙA","Tôi vừa mới nói chơi...","Nhạc Pháp"
50748,"TÌNH THIÊN THU","Chuyện tình tôi như...","Nhạc ngoại"
50753,"QUÁN GIÓ","Nhà xây ngói đỏ chói...","Nhạc ngoại"
50754,"TÌNH YÊU ƠI TÌNH YÊU","Cuộc tình ngày đó...","Nhạc Pháp"
50751,"TÌNH YÊU MÀU XANH","Thiết tha say sưa ân tình...","Nhạc ngoại"
50752,"NGƯỜI ĐẸP","Người đẹp yêu dấu đẹp như trăng sao...","Nhạc ngoại"
50757,"NGÀY HÔM QUA (YESTERDAY)","Mới hôm qua muộn phiền...","Nhạc ngoại"
50758,"LIỀU THUỐC CHO TRÁI TIM","Mùa đông đến như vây kín...","Nhạc Hoa, Lời Việt: Thái Hùng"
50755,"NGƯỜI ĐÀN BÀ ĐANG YÊU","Kiếp sống mong manh như tơ trời...","Nhạc Pháp"
50756,"NHỮNG LỜI XIN EM","Em em hãy cho tôi lời nói...","Nhạc ngoại"
50750,"TÌNH CHO KHÔNG","Ngon như là táo chín...","Nhạc ngoại"
50759,"TÌNH CA MUÔN THUỞ","Em dấu yêu anh ước mơ...","Nhạc ngoại"
50762,"NHẠC CHIỀU","Gió đưa đến hồn tôi nhạc chiều từ biển khơi...","Nhạc ngoại"
50764,"TAN TÁC","Ta đưa người đi đường về tình chia hai lối...","Nhạc ngoại, Lời Việt: Tứ My"
50765,"NÓI SAO CHO EM HIỂU (HOW CAN I TELL HER)","Khi anh sống trong âm thầm...","Nhạc ngoại"
50766,"LỠ CUNG ĐÀN","Tha thiết gửi mấy cung đàn...","Hoàng Giác"
50767,"NGƯỜI TÌNH NAM MỸ","Là mặt trời mùa xuân Nam Mỹ...","Nhạc ngoại"
50768,"LÝ CON SÁO 2","Ai đem con sáo mà sang sông...","Dân ca Nam Bộ, Lời: Lư Nhất Vũ"
50769,"NGƯỜI EM MIỀN CÁT TRẮNG","Hoàng hôn biển khơi bọt sóng vương sầu...","Minh Kỳ"
50760,"TÌNH THOÁNG BAY","Tình buồn trôi qua...","Nhạc ngoại"
50761,"VAI ÁO MÀU XANH","Tình tôi tan nát...","Nhạc ngoại"
50779,"TỰ CHỦ (SELF CONTROL)","Từng đêm vui ngây ngất đời...","Nhạc ngoại"
50777,"XÍCH LẠI GẦN NHAU","Thời gian như dừng trong phút giây...","Nhạc ngoại"
50778,"SẦU TƯƠNG TƯ","Son phấn nào đâu...","Nhạc ngoại"
50775,"XÓM VẮNG","Nửa khuya về xóm vắng...","Nhạc Hoa"
50776,"LỜI MẸ RU","Nghe những lời ru ầu ơ gió chiều ...","Hoài An"
50773,"NHỚ MÙA THU HÀ NỘI","Hà Nội mùa thu cây cơm nguội vàng...","Trịnh Công Sơn"
50774,"TIẾNG THU","Em không nghe mùa thu...","Lê Thương"
50771,"NHẠC SẦU TƯƠNG TƯ","Chiều rơi cho lòng lạc loài chơi vơi...","Hoàng Trọng"
50772,"QUA MIỀN HÀ TIÊN","Ngày nào qua Hà Tiên...","Y Vân"
50770,"TRỌN KIẾP YÊU NGƯỜI","Em trọn kiếp thương về...","Nhạc Hoa"
50788,"TÌNH EM BIỂN CẢ","Chưa có bao giờ...","Nguyễn Đức Toàn"
50789,"NHỚ","Anh ơi em xin anh đừng có hỏi...","Lê Uyên, Thanh Hải"
50784,"NỖI ĐAU NIỀM NHỚ","Đừng nhìn em xin anh lắng nghe...","Nhạc ngoại"
50785,"NƯỚC MẮT HỌC TRÒ","Hỡi người yêu ơi...","Bảo Chấn"
50786,"Ở HAI ĐẦU NỖI NHỚ","Có một không gian nào...","Phan Huỳnh Điểu"
50787,"TÌNH CA VŨNG TÀU","Chiều chiều em đạp xe...","Hoàng Vân"
50780,"TÌNH CA MÙA XUÂN","Hương trinh nguyên thắt thành...","Tôn Thất Lập"
50781,"LỜI RU TÌNH","Chờ em từng cơn gió...","Lê Quang"
50782,"TÌNH CA CHO EM","Tình yêu là chiếc lá xanh...","Nguyễn Nam - Phan Vũ"
50783,"MÃI YÊU EM","Ha... Đừng tìm nhau chi hỡi người...","Nhạc Hoa, Lời Việt: Lý Hải"
50790,"SAMBA MAMBO","Cùng hát lên vũ khúc SamBa...","Nhạc ngoại"
50792,"SUỐI MƯỜNG HUM CÒN CHẢY MÃI","Bản Mường Hum non ngàn...","Nguyễn Tài Tuệ"
50791,"NGƯỜI GIÁO VIÊN TRẺ","Trên những nẻo đường của Tổ quốc xanh tươi...","Thanh Sơn - Hoàng Vân"
50794,"TỰ HÀO ĐI LÊN ÔI VIỆT NAM","Ta đứng đầu ngọn sóng ư...","Chu Minh - H.T.Thông"
50793,"TIỂU ĐOÀN 307","Ai đã từng đi qua...","Nguyễn Hữu Trí"
50796,"TIẾNG GỌI SÔNG ĐÀ","Anh lên đây với quê em đất Mường...","Trần Chung"
50795,"TÌNH YÊU NGƯỜI THỢ MỎ","Bình minh đang lên...","Hoàng Vân"
50798,"TRĂNG SÁNG ĐÔI MIỀN","Trăng lùa lên cành tre...","An Chung"
50797,"TIẾNG ĐÀN TA LƯ","Đi chiến trường gùi trên vai...","Huy Thục"
50799,"THÀNH PHỐ HOA PHƯỢNG ĐỎ","Tháng năm rợp trời hoa phượng đỏ...","Lương Vĩnh - Hải Như"
50801,"VÌ ANH YÊU EM","Tình yêu ta xanh tươi...","Nhạc ngoại"
50802,"XIN CHÀO (HELLO)","Khi quen em trong đêm khiêu vũ...","Nhạc ngoại"
50800,"KHÚC HÁT CHIỀU HÀ NỘI","Những ngày hè khi mặt trời xuống dần...","Nhạc: Lương Vĩnh, Lời: Hải Như"
50820,"CHỈ CÒN MÌNH ANH","Người ra đi để sầu úa...","Nhạc Hoa, Lời Việt: Lữ Liên"
50823,"TRIỆU ĐÓA HOA HỒNG","Chuyện một tình yêu anh họa sĩ...","Nhạc Liên Xô"
50824,"GIĂNG CÂU","Em hỏi anh đêm nay đi đâu...","Tô Thanh Tùng"
50821,"DĨ VÃNG NHẠT NHÒA","Đêm trắng đêm ngồi nhìn ánh trăng về...","Nhạc Hoa"
50822,"MỖI TRÁI TIM MỘT TẤM LÒNG","Thương sao bao nhiêu em thơ...","Thế Hiển"
50817,"ANH CẦN CÓ EM","Như là cuộc sống mong đợi thương yêu...","Nhạc ngoại"
50816,"BÀI CA THANH NIÊN CÔNG NHÂN","Chúng ta là thanh niên công nhân, của thành phố...","Phạm Đăng Khương"
50815,"BÀI CA NHỚ BÁC","Bác ơi thương nhớ vô cùng, thầm gọi tên...","Xuân Quang"
50814,"ÁNH TRĂNG HÒA BÌNH","Ánh trăng tròn lướt qua ngọn tre, trăng lấp lánh...","Nhạc: Hồ Bắc, Lời: Mộng Lân"
50819,"MẸ TÔI","Mưa về trên khu phố khuya...","Quốc An"
50818,"KỶ NIỆM NÀO VỘI TAN","Tình về trong đêm vắng...","Nhạc ngoại"
50810,"AI THƯƠNG CON NHIỀU","Ba với mẹ đều thương con, nhưng không biết...","Vũ Hoàng"
50811,"VỘI VÀNG CHI EM HỠI","Vội vàng chi em hỡi...","Nhạc ngoại"
50812,"ANH KHÔNG CÒN YÊU EM NỮA ĐÂU","Dâng hơi men cay nhói lên niềm đau trong trái tim...","Thái Khang"
50813,"EM ĐI RỒI","Em để rồi đêm nay trăng sao trên vòm mây cao...","Nhạc ngoại"
50804,"YÊU EM TUỔI MƯỜI LĂM","Em yêu tuổi mười lăm...","Phạm Thanh Sơn"
50803,"NGƯỜI TÌNH YÊU DẤU","Này người tình anh yêu ơi ...","Nhạc Hoa"
50806,"CUỘC TÌNH MONG MANH","Biển rộng đến chân trời...","Nhạc Hoa"
50805,"TRỞ LẠI CAO BẰNG","Khi trở lại Cao Bằng...","Tân Huyền"
50808,"NỤ HÔN VĨNH BIỆT","Xin hãy hôn em hôn lần cuối...","Nhạc ngoại"
50807,"CHIẾC LÁ MÙA ĐÔNG","Mùa đông trên thung lũng xa...","Nhạc ngoại"
50809,"EM VỀ NÀO CÓ HAY","Em đi về cỏ hoang khắp lối...","Nhạc ngoại"
52429,"TÓC BAY TRONG CHIỀU","Nắng tháng mười cho em hồng đôi má, mưa tháng tư...","Nhạc: Sông Trà, Thơ: Nguyễn Cúc"
52428,"TÌNH QUÊ","Về đây thăm Quảng Nam, trong lòng tôi nghe xốn xang...","Trần Quế Sơn"
52427,"TÌNH NGOẠI","Ngoại gửi cho em hình bóng quê nhà, ngõ về thôn xa...","Vinh Sử"
52426,"TÌNH HỮNG HỜ","Vào một đêm mùa xuân ngát hương, trời về khuya...","Thanh Sơn"
52425,"TÌM VỀ NƠI TRÚ MƯA","Xưa trú mưa dưới hiên bất chợt rơi, bóng đêm đã buông...","Bảo Chinh"
52424,"TIỀN VÀ LÁ","Ngày thơ hớt tóc miễng dừa, ngày thơ mẹ bắt đeo bùa...","Nhạc: Lý Dũng Liêm, Thơ: Kiên Giang"
52423,"THUYỀN EM ĐI TRONG ĐÊM","Đêm nay đêm nay có thuyền em đi, truyền trôi nhanh...","Nguyễn Phú Yên"
52422,"THẾ GIỚI KHÔNG TÌNH YÊU","Tình yêu là gì mà thế giới phải khóc, khi mộng mơ...","Kim Tuấn"
52421,"THẬT LÒNG PHẢI NÓI XA EM","Anh phải rời xa em thôi, cuộc tình gian dối...","Lê Quốc Dũng"
52420,"THẬT LÒNG","Chuyện tình yêu ai đâu biết ngày mai sẽ chia hai...","Nhất Trung"
52409,"NÓI ĐI ANH","Chiều mưa rơi mưa rơi mưa nhẹ rơi trên vai em...","Phạm Hòa Khánh"
52417,"TAXI","Anh không cần em để cho mắt môi em buồn...","Sĩ Luân"
52416,"ROMANCE ĐÊM","Chẳng còn cây thay lá bên thềm níu chân người...","Nguyễn Đình Nguyên"
52419,"THÀ LÀM NGƯỜI BẠN THÂN","Mình chỉ là người bạn thân thôi, chứ đừng nên...","Minh Khang"
52418,"TÂM SỰ MỘT LỜI CA","Khi biết yêu đầu tiên, tình em đã trao về anh...","Tiến Luân - Đynh Trầm Ca"
52413,"QUAY ĐẦU LÀ BỜ","Nhắm mắt lại anh không tin vì sao em ra đi...","Minh Khang"
52412,"PHÚT BAN ĐẦU","Tóc em dài làm muôn con suối, nét em cười...","Nguyễn Bá Nghiêm"
52415,"RỒI ÁNH TRĂNG TÀN","Rồi ánh trăng cũng đã phai dần, rồi những ước mơ...","Quốc Bảo"
52414,"QUÊ HƯƠNG MÌNH BÌNH DƯƠNG","Từ miền xa ta đến nơi đây gặp lại nhau...","Phạm Đăng Khương"
52411,"NỖI NHỚ TÌNH TÔI","Tình yêu xưa như trăng như sao, hạnh phúc thay...","Hoài An"
52410,"NỖI ĐAU VÔ THƯỜNG","Đường nào em đi cố quên giấc mộng xuân thì...","Thái Hùng"
52448,"CON ĐƯỜNG MANG TÊN EM ","Trở lại chuyện hai chúng mình, khi anh với em...","Cổ nhạc: Loan Thảo, Tân nhạc: Trúc Phương"
52447,"ANH ĐI XA CÁCH QUÊ NGHÈO ","Mưa gió lạnh triền miên đêm đã khuya, ngàn nhớ nhung...","Viễn Châu"
52446,"YÊU SAO NOEL","Yêu làm sao bé yêu làm sao Giáng Sinh nồng nàn...","Khắc Dũng"
52445,"YÊU GIẢ","Đã bao ngày tháng em mãi cố thương hại anh...","Bảo Chinh"
52449,"CÔ GÁI BÁN SẦU RIÊNG ","Ai mua sầu riêng có ai mua sầu riêng, hãy dừng chân...","Cổ nhạc: Viễn Châu, Tân nhạc: Trương Minh Châu"
52440,"VÔ TÌNH","Vô tình em lại được gặp anh trong giấc mơ...","Thái Khang"
52444,"YÊU DẤU HÀ TIÊN","Anh trở lại Hà Tiên thăm em người em dịu hiền...","Thanh Sơn"
52443,"XUÂN CA","Xuân đến xuân đến rồi ta cùng nhau ra phố...","Nguyễn Ngọc Thiện"
52442,"XA RỒI HẠNH PHÚC GIAN NAN","Trong căn nhà quạnh hiu anh ngồi lặng ôm đêm tối...","Tiến Luân, Đynh Trầm Ca"
52441,"VU VƠ","Chợt nhớ lúc xưa tan trường về, gặp em...","Lê Quốc Dũng"
52435,"VẦNG TRĂNG KHÓC","Đã không còn người yêu hỡi, ngày xưa ấy đôi ta...","Nguyễn Văn Chung"
52434,"VẦNG TRĂNG CỦA MẸ","Chỉ một lần con về thăm mẹ thôi, mà nay hương khói...","Trần Quang Lộc"
52437,"VÌ SAO KHÔNG THA THỨ CHO NHAU","Gió lạnh tràn về, cát bụi đường trần, lá xác xơ rơi...","Hoài An"
52436,"VỊ ĐẮNG TÌNH YÊU","Trong nỗi đau vô tình vầng trăng lãng quên...","Nguyễn Minh Anh"
52439,"VÒNG TAY TÌNH YÊU","Từng đêm vắng ước chi có em bên cạnh...","Bảo Chinh"
52438,"VÌ SAO THẾ","Đến làm gì để rồi nay em ra đi, đến làm gì...","Phạm Hòa Khánh"
52431,"TRĂM NĂM HẠNH PHÚC","Đón vu quy pháo hồng trước ngõ, em theo chồng...","Hà Phương"
52430,"TÔI MƠ","Cho tôi một làn mây trắng, lang thang về trên mái tranh...","Võ Thiện Thanh"
52433,"ƯỚC THẦM","Tôi trở về thăm chốn quê xưa, thăm ngôi trường học...","Nhạc: Tô Thanh Tùng, Thơ: Quan Huy Ích"
52432,"TƯỞNG NHƯ 2","Tưởng như ta đánh mất, đánh mất nhau trong đời...","Nhạc: Sông Trà, Thơ: Phương Hồng Nguyễn"
53909,"NẾU EM KHÔNG PHẢI LÀ GIẤC MƠ","Nếu em có trăm niềm vui với trăm nỗi buồn...","Nguyễn Văn Chung"
53905,"MÙA HÈ KỶ NIỆM","Với bao nhiêu cuộc vui tàn, với bao nụ hôn rất vội...","Việt Anh - Anh Khoa"
53906,"MÙA THU KHÉP LẠI","Từ đây mình anh trên lối về, ngày mai một mùa thu khép lại...","Nhạc: Anh Tuấn, Lời: Việt Anh"
53907,"MƯA NƯỚC MẮT","Đoạn đường ngày hôm nay, sao có mưa bay bên đôi hàng cây...","Nguyễn Văn Chung"
53908,"MƯA VÀ NỖI NHỚ","Ngày nắng vội tắt hạt mưa bỡ ngỡ về...","Hồ Hoài Anh"
55472,"YÊU","Đôi tim hứa sẽ yêu thiết tha sẽ mãi không rời xa...","Phạm Khánh Hưng"
55471,"XUÂN TRƯỜNG QUÊ TÔI","Xuân Trường quê tôi đồng lúa mượt xanh, vườn dâu trải rộng...","Phạm Minh Tuấn"
55470,"XUÂN BÊN EM","Ah đi đi bên em, đôi mình tay trong tay cho mùa xuân ngất ngây...","Lương Ngọc Châu"
55475,"YÊU LÀ SAO","Yêu là sao cho tôi vài câu yêu là gì mà sao cay đắng...","Bá Vĩnh"
55476,"YÊU YÊU YÊU (LOVE LOVE LOVE)","Love love love tình yêu mà em dành riêng trao về anh...","Duyên Hương, Đinh Công Minh"
55473,"YÊU ANH NHIỀU HƠN","Có những khi u buồn trong em rất cô đơn...","Thái Thịnh"
55474,"YÊU EM MÙA XUÂN","Khi anh đưa em về lòng em bối rối anh ơi...","Nguyễn Nhất Huy"
53913,"NGÀY EM ĐI","Ngày em đến dịu dàng mắt nai mộng mơ...","Nguyễn Văn Chung"
53912,"NGÀY ĐÓ TÔI YÊU EM","Ngày đó những thiết tha những dấu yêu...","Minh Vy"
53915,"NGÀY MAI XA CÁCH","Hoàng hôn buông xuống đàn ngân tiếng nghe phôi pha...","Minh Vy"
53914,"NGÀY KHÔNG EM","Một ngày không em anh có buồn không...","Minh Vy"
53911,"NGÀY CUỐI TUẦN RỰC RỠ","Mặt đường bốc lên cái nóng mùa hè...","Đỗ Bảo"
53910,"NGÀY ANH RA ĐI","Chờ anh mãi, em chờ anh mãi giữa trời giông tố...","Mỹ Tâm"
55461,"VÌ EM BIẾT","Xin đừng nói nữa lời yêu ấy giờ đã hết...","Mai Hồng Hạnh"
55460,"VỆT NẮNG CUỐI TRỜI","Xa mãi tận cuối trời lấp lánh cùng dòng mưa rơi...","Tiến Minh"
55462,"VÌ QUÁ YÊU ANH","Lại một đêm trôi cứ trôi vô vọng, lại một bóng em trầm ngâm...","Mạnh Quân"
55463,"VÌ SAO","Vì sao khi anh đi em đã không ôm lấy anh hỡi người...","Khởi My - Hoàng Rapper"
55464,"VINH DANH GIA ĐÌNH TRUYỀN THỐNG VIỆT NAM","Cùng thắp sáng lên truyền thống gia đình, tình yêu muôn đời...","Viết Tuấn"
55465,"VÒNG TRÒN TÌNH YÊU","Tình yêu đến kế bên mà ta đâu có hay...","Lê Minh Kha"
55466,"VƯỜN HOA TÌNH YÊU","Vườn hoa ngày xưa khi mới yêu nhau mình đã hẹn thề...","Nguyễn Minh Anh"
55467,"XA DẦN BÓNG EM","Lặng nhìn thời gian trôi qua mà lòng anh thêm xót xa...","Bình Nguyên"
55469,"XE BUÝT HAI TẦNG","Tuổi thơ đầy những giấc mơ diều bay vội qua cánh đồng...","Thảo Châu - Gia Đoàn"
53904,"MỘT LẦN THÔI","Một lần cuối một lần thôi được bên em...","Minh Nhiên"
53903,"MỘT LẦN NỮA XIN CÓ NHAU","Xin cho anh một lần nữa có em, không anh ơi vì tình ta đã phai...","Phương Uyên"
53902,"MƠ KHÚC TƯƠNG PHÙNG","Mối tình ta dở dang bởi ai, ước nguyền như thế...","Lam Minh"
53901,"MIỀN NAM ƠI CHÚNG TÔI ĐÃ SẴN SÀNG","Miền Nam đang gọi ta vượt Trường Sơn bay vọng ra...","Lưu Cầu"
53900,"LÝ THƯƠNG NHAU","Thương nhau trường đoạn í a đoạn trường...","Nhạc: Dân ca Trung Bộ, Lời: Hoàng Anh"
53927,"NHỮNG CON ĐƯỜNG VẮNG ANH","Em vẫn như thế một chút u uất trong bàn tay...","Việt Anh"
53928,"NHỮNG NGÀY KHÔNG ANH","Anh chắc không còn nhớ tháng năm mặn nồng tình ta...","Phương Uyên"
53929,"NIỀM TIN","Khẽ nhắm mắt nghe tương lai mịt mù...","Nguyễn Hồng Thuận"
55450,"TRONG ANH SẦU ĐÃ LÊN NGÔI","Dù có ra sao vẫn xin được mãi bên nhau...","Thái Hùng"
55457,"ƯỚC MƠ XUÂN","Một mùa xuân em yêu thiết tha một mùa xuân bao nhiêu gấm hoa...","Quế An"
55458,"VẪN BIẾT YÊU LÀ THẾ","Lúc trước tôi nào biết tình sẽ phai tàn mau...","Đỗ Đình Phúc"
55455,"TUYẾT CHƯA TAN","Vẫn yêu em cho dù mình đã cách rời, vẫn yêu em cho dù...","Nguyễn Văn Chung"
55456,"U SẦU","Tình yêu nào anh trao tôi, tình yêu nào anh trao ai...","Nhật Đăng"
55453,"TRUYỀN THUYẾT PHÙ ĐỔNG THIÊN VƯƠNG","Đời Hùng Vương thứ sáu, bọn giặc Ân đánh chiếm nước Nam ta...","Chương Đức"
55454,"TRƯỜNG ƠI","Trường ơi bất chợt sớm mai nào em lạc bước vòm xanh lá sao...","Nhạc: Lê Hoàng Chung, Lời: Thanh Nguyên"
52400,"NGƯỜI PHỤ NỮ TỰ TIN","Trong cuộc sống tôi đã học được nhiều đắng cay...","Minh Khang"
55451,"TRÓT YÊU ANH RỒI","Chẳng muốn xa anh anh ơi khi em trót yêu anh mất rồi...","Đức Trí - Hồ Ngọc Hà"
55452,"TRỞ VỀ HÀ NỘI","Trở về đón gió heo may cái se se lạnh làm say lòng người...","Nhạc: Vũ Cẩm, Lời: Đinh Thế Vinh"
53931,"NƠI LÀM ANH CHÙN BƯỚC","Hôm qua chuyện như mơ khi anh nhẹ hôn vào môi em...","Lương Bằng Quang"
52403,"NHỚ MẸ LÝ MỒ CÔI","Mẹ qua đời khi con còn trong nôi, cha bỏ con bơ vơ...","Trương Quang Tuấn"
53930,"NÒI GIỐNG TIÊN RỒNG","Hô hô hô hô hô hô...như sấm vang chuyển rung trời xanh...","Chương Đức"
52404,"NHỚ VỀ EM","Đêm đêm gió thổi từng cơn, gió lại về từng cơn...","Nguyễn Ngọc Thiện"
53933,"NỤ CƯỜI CHO NHÂN GIAN","Bình minh đến bóng đêm tàn sương rơi...","Minh Châu"
52401,"NHẮN CÁNH CHIM CHIỀU","Tình yêu thoát xa tầm tay, còn đâu cánh chim trời bay...","Khánh Băng"
53932,"NƠI TÌNH YÊU ĐƯỢC LẤP ĐẦY","Một lần nữa anh như được thấy con tim yêu trở lại...","Lương Bằng Quang"
52402,"NHỚ BÀ MẸ QUÊ","Bà mẹ quê hy sinh suốt đời, bà mẹ quê ru con ...","Nguyễn Đức Trung"
53935,"ỐNG THỔI LỬA","Hơi thở mẹ nhen nùi rơm con cúi...","Nhạc: Tiến Luân, Thơ: Kiên Giang"
52407,"NỢ DUYÊN","Bóng dáng ai đẹp xinh cho lòng ta đang chìm đắm..","Thái Khang"
53934,"NƯỚC MẮT ĐÊM THÂU","Khi yêu nào ai có biết cho nhau thật nhiều yêu thương...","Nguyễn Hồng Thuận"
52408,"NỢ EM MỘT KHÚC DÂN CA","Còn nhớ không anh những ngày thơ chân đất lưng trần...","Tiến Luân"
52405,"NHỮNG ÂM VẦN BIẾT NÓI","Đây là chữ i mà ngày xưa con còn bé tí...","Khắc Dũng"
55459,"VỀ LẠI PHONG CHÂU","Người ơi về lại đền Hùng, cùng ta hoa gạo nở bừng sắc ư ư xuân...","Nhạc: Phan Lai Triều, Lời: Trần Ninh Hồ"
53937,"QUẢNG TRỊ YÊU THƯƠNG","Quảng Trị ơi quê mẹ của tôi ơi, chẳng thể nào quên...","Trần Hoàn"
53936,"QUA MIỀN TÂY BẮC","Qua miền Tây Bắc núi vút ngàn trùng xa...","Nguyễn Thành"
52406,"NHỮNG NỐT NHẠC XANH","Vì đời cần những giai điệu đẹp, nên ta làm...","Nguyễn Ngọc Thiện"
