51988,"CHỜ EM ĐÊM MÙA ĐÔNG","Đêm nay trên phố đông ngoài kia bao đôi gái trai tay trong tay...","Nguyễn Đình Nguyên"
51987,"CHỚ NUỐI TIẾC","Chớ nuối tiếc những ngày mà ta đã yêu nhau trong mộng mơ...","Lý Hải"
51989,"CHỒI XANH","Hoang vu mặt đất như hư không lặng yên, làn khói đen...","Minh Châu"
51984,"CHIẾN SĨ VIỆT NAM","Bao chiến sĩ anh hùng lạnh lùng vung gươm...","Văn Cao"
51983,"BỨC HỌA ĐỒNG QUÊ","Trời xanh xanh bao la, mây trắng trắng trắng xóa...","Văn Phụng"
51986,"CHIỀU NƯỚC LŨ","Anh về thăm quê mưa sa giông chiều nước lũ...","Vinh Sử"
51985,"CHIẾN THẮNG ĐIỆN BIÊN","Giải phóng Điện Biên bộ đội ta tiến quân trở về...","Đỗ Nhuận"
51724,"CHẠY TRỐN KỶ NIỆM","Mưa rơi mưa rơi buồn tênh buồn mãi rơi hoài ...","Nguyễn Hoài Anh"
51980,"BÓNG MÁT CHỞ CHE","Trở về quê hương một chiều mùa đông, trời đông...","Nhạc: Sông Trà, Lời: Nguyễn Đức Tư"
51723,"THÀ MỘT LẦN ĐAU","Cứ mãi nhắm mắt bước đi trong mơ ...","Nguyễn Hoài Anh"
51982,"BÔNG HỒNG TẶNG CÔ","Em trồng giàn bông trước cửa nhà em ...","Trần Quang Huy"
51726,"BẾN VẮNG","Chiều gió mưa anh đã ra đi thật rồi ...","Nguyễn Nhất Huy"
51725,"TÌNH ĐỜI NGHỆ SĨ","Em đi đường em tôi đi đường tôi cuộc tình mình...","Nguyễn Ngọc Thạch"
51981,"BÓNG MÂY QUA THỀM","Nàng đi qua lối đó, mùi hương bay theo gió, sợ cà phê bên đó...","Võ Thiện Thanh"
51720,"YÊU DẤU ĐÃ VỀ","Này em về đây có nhau giây phút này...","Minh Châu"
51722,"ĐƯỜNG VỀ ĐƠN CÔI","Cha cha ra ... Tiếng mưa rơi cho lòng nghe giá băng...","Nguyễn Hoài Anh"
51721,"NGƯỜI TA NÓI","Có một người vẫn yêu một người vẫn đợi chờ...","Nguyễn Hoài Anh"
51716,"HÃY ĐẾN BÊN ANH","Đã bao ngày lòng anh cứ mong chờ...","Lê Quang"
51717,"LỜI RU NGÀN ĐỜI","Trùng trùng quân đi ngàn dặm, rợp trời cờ bay bốn phương...","Lê Quang"
51718,"TÌNH XÓT XA THÔI","Thấy bóng dáng ai đang về quanh em...","Lê Quang"
51719,"TRÁI TIM BÌNH YÊN","Mặt trời sáng sớm đã lên cho đàn chim sớm mai quay về...","Lê Quang"
51975,"BÀI CA NGƯỜI LÍNH","Đường dài hành quân xa đi khắp non sông nhà...","Diệp Minh Tuyền"
51974,"BAY CAO TIẾNG HÁT ƯỚC MƠ","Đỏ thắm khăn quàng trên màu cờ...","Nguyễn Nam"
51973,"ÁO MỚI CÀ MAU","Nghe nói Cà Mau xa lắm ở cuối cùng bản đồ Việt Nam...","Thanh Sơn"
51972,"ÁNH MẮT KIÊU XA","Biết bao ngày ngồi trông ngóng, bước chân người qua lối này...","Trung Quân"
51751,"TÌNH YÊU ĐẦU TIÊN","Cơn mưa vừa qua đây tình anh mới hôm nào ...","Dương Đức Thụy"
51979,"BÓNG CẢ","Nhớ đến những lúc ấu thơ, sống dưới mái ấm mến thương....","Vũ Quốc Việt"
50220,"ĐÓN XUÂN NÀY NHỚ XUÂN XƯA","Đón xuân này tôi nhớ xuân xưa...","Châu Kỳ"
51750,"CÂY ĐÀN GHI TA CỦA ĐẠI ĐỘI BA","Cây đàn ghi ta của đại đội ba khi hành quân xa ...","Xuân Hồng"
51978,"BẾN CẢNG QUÊ HƯƠNG TÔI","Khi xuân sang trên bến cảng, đàn hải âu tung cánh...","Hồ Bắc"
50221,"ĐÔI NGẢ ĐÔI TA","Một đêm trăng sáng...","Trần Thiện Thanh"
51977,"BÃO NỔI LÊN RỒI","Bão nổi lên rồi từ miền Nam quê hương thân yêu...","Trọng Bằng"
50222,"TÌNH THẮM DUYÊN QUÊ","Tình nồng thắm xuyên qua...","Trúc Phương"
51976,"BÀI THÁNH CA BUỒN","Bài thánh ca đó còn nhớ không em...","Nguyễn Vũ"
51755,"TRÁI TIM KHÔNG LỜI","Này anh bao nhiêu đêm dài thao thức đã nói hết...","Nguyễn Hồng Sơn"
50223,"NHƯ KHÚC TÌNH CA","Tôi vẫn thấy em như ngày nào...","Nguyễn Ngọc Thiện"
51754,"TUỔI MỘNG XỨ ĐÔNG (MƯA TRÊN PHỐ)","Hey la la ... Anh hỡi anh khi trời mưa lất phất trên phố ...","Minh Tâm"
50224,"CÒN TUỔI NÀO CHO EM","Tuổi nào nhìn lá vàng úa chiều nay...","Trịnh Công Sơn"
51753,"TÌNH LẺ BÓNG","Bấy nhiêu luyến bấy nhiêu lưu cũng thế...","Lương Bằng Vinh"
50225,"ANH VẪN CÒN CÔ ĐƠN","Sao chiều nay anh không sang thăm tôi...","Hoàng Trang"
51752,"VẮNG EM TRONG ĐỜI","Vắng bóng một người sao lòng ta luôn mênh mang...","Lư Anh"
50226,"KỶ NIỆM NÀO BUỒN","Ngày đôi ta quen nhau...","Hoài An"
51759,"TÔI KHÔNG TIN","Tôi không tin đời tôi có em rồi phải xa em suốt đời ...","Nhạc Hoa, Lời Việt: Quang Huy"
50227,"MÙA THU CÒN ĐÓ","Mùa thu ơi nghe nói rằng...","Châu Kỳ"
51971,"ANH VẪN HÀNH QUÂN","Anh vẫn hành quân trên đường ra chiến dịch...","Nhạc: Huy Du, Lời: Trần Hữu Thung"
50228,"HOA MƯỜI GIỜ","Hôm chia tay chiều chủ nhật...","Đài Phương Trang"
51758,"GIỌT NẮNG CUỐI CHIỀU","Mưa cuốn trôi bao kỷ niệm dĩ vãng ...","Quang Huy"
51970,"ANH PHẢI LÀM SAO","Làm sao anh yêu thương một người...","Nhất Trung"
51757,"NHẬT KÝ","Về nhà làm gì khi đau thương giày xéo cõi lòng...","Nhạc Hoa, Lời Việt: Đỗ Quang"
50229,"ĐIỆP KHÚC MÙA XUÂN","Nắng chiếu lung linh muôn hoa vàng...","Quốc Dũng"
51756,"BAO GIỜ NGƯỜI TRỞ LẠI","Mưa còn mãi rơi trên đường vắng...","Tuấn Thăng"
51749,"HÃY HÁT LÊN","Gió vẫn còn gọi mùa thu đến khắp trời...","Vũ Quốc Việt"
51969,"ANH MUỐN NÓI YÊU EM","Ngày ta gặp gỡ phút giây ban đầu tình sao êm ái...","Quốc Vượng"
51962,"LƯƠNG SƠN BÁ 1 ","Trên nẻo về Nam Sơn nhớ ai lòng nát tan...","Viễn Châu"
51961,"LÁ DIÊU BÔNG 2","Mùa đông sau em tiếp công đi ngày đêm dầm mưa dãi nắng...","Cổ nhạc: Quy Sắc, Tân nhạc: Hoàng Cầm"
51964,"MỪNG TUỔI MẸ 1","Mỗi mùa xuân sang mẹ tôi già thêm một tuổi...","Cổ nhạc: Huỳnh Nguyên, Tân nhạc: Trần Long Ẩn"
51963,"LƯƠNG SƠN BÁ 2 ","Em ơi duyên ngàn dặm kiếp này thôi đã lỡ...","Viễn Châu"
51966,"THƯƠNG VỀ MIỀN TRUNG 1 ","Đã bao lâu rồi không về miền Trung...","Cổ nhạc: Viễn Châu, Tân nhạc: Minh Kỳ"
50210,"AI LÊN XỨ HOA ĐÀO","Ai lên xứ hoa đào...","Hoàng Nguyên"
51965,"MỪNG TUỔI MẸ 2","Mẹ già như chuối chín cây gió lay mẹ rụng...","Cổ nhạc: Huỳnh Nguyên, Tân nhạc: Trần Long Ẩn"
50211,"ĐƯỜNG VỀ HAI THÔN","Đường về thôn em...","Phạm Thế Mỹ"
51740,"VỀ ĐÂU EM HỠI","Hãy nói một lời một lời yêu thương thiết tha chân tình...","Quốc An"
51968,"ANH EM TA VỀ","Anh em ta về cùng nhau ta quây quần này...","Tiến Lộc"
51967,"THƯƠNG VỀ MIỀN TRUNG 2 ","Em ơi chờ anh về đừng cho năm tháng...","Cổ nhạc: Viễn Châu, Tân nhạc: Minh Kỳ"
50214,"TUỔI THƠ","Trời xanh xanh mát...","Lê Thương"
51742,"EM TẬP TÔ MÀU","Em tập tô màu trên giấy trắng phau ...","Sông Trà"
50215,"MÙA XUÂN TÌNH BẠN","Chào mùa xuân đến....","Cao Minh Khanh"
51741,"TÌNH YÊU TRONG LÀNH","Có niềm vui nào đang đến cùng em...","Quốc Bảo"
50212,"TIẾNG HÁT HỌC TRÒ","Thuở ấy không gian...","Minh Kỳ"
51744,"NGƯỜI EM ƯỚC MƠ","Duyên em đẹp mơ bao nơi đến em hững hờ ...","Tâm Giao"
50213,"TÌNH YÊU BAN ĐẦU","Người tôi yêu ơi chiều nay mưa rơi rơi...","Nguyễn Ngọc Thiện"
51743,"PHỐ CHIỀU MƯA BAY","Anh ra phố chiều nay chiều nay mưa bay bay...","Sông Trà"
50218,"RẠNG ĐÔNG TRÊN QUÊ HƯƠNG","Trên đồi núi anh đi qua...","Phạm Thế Mỹ"
51746,"DỄ THƯƠNG","Nắng con trai mong manh sợi nhớ ...","Trương Quang Tuấn"
50219,"THÀNH PHỐ TRẺ","Em đi đâu về mà tóc đầy me ...","Trần Tiến"
51745,"ĐẾN BÊN EM","Đến bên em đêm nay sầu vương cô đơn em nhắc tên người...","Trần Huân"
51960,"LÁ DIÊU BÔNG 1","Gái Đình Bảng váy buông chùng cửa vóng...","Cổ nhạc: Quy Sắc, Tân nhạc: Hoàng Cầm"
51748,"BA LÔ CON CÓC","Chú mang trên vai ba lô con cóc ...","Vũ Hoàng"
50216,"NGÀY CƯỚI EM","Hôm nay ngày cưới em...","Y Vũ"
51747,"XÍCH LÔ","Là là la ... Xích lô ai không hay đắn đo...","Võ Thiện Thanh"
50217,"CÔ BÉ DỖI HỜN","Chiều nay vừa tan buổi học...","Nguyễn Ngọc Thiện"
51738,"VÌ MỘT THẾ GIỚI NGÀY MAI (SEAGAMES 22)","Nắm tay nhau cùng bước bên nhau vì hạnh phúc nhân loại...","Quang Vinh"
51739,"NẾU MAI NÀY XA NHAU","Vì sao em cứ mãi yêu người nguyện yêu anh yêu mãi...","Quốc An"
50209,"GIÃ BIỆT HÀNH","Chiều nay xong bỏ cuộc chơi...","Lã Văn Cường"
51958,"CHÚC ANH ĐÀI 1 ","Sương trắng nhuộm rừng phong vấn vương...","Viễn Châu"
51959,"CHÚC ANH ĐÀI 2 ","Viên ngọc bích trao nhờ sư mẫu...","Viễn Châu"
54809,"NHƯ GIẤC MƠ","Ngơ ngác nhìn hạt sương trắng long lanh vai mềm...","Văn Phong"
54808,"NHƯ CON CHIM SẺ","Tung tăng như con chim sẻ bé vui bé đi nhà trẻ...","Lương Bằng Vinh"
54807,"NHỚ EM (MISS YOU)","Có những lúc ngẩn ngơ trong tình yêu của em quá khờ...","Sỹ Luân"
54812,"NỖI BUỒN MẸ TÔI","Đêm thức thâu đêm, mẹ may chiếc áo cho con áo nào sờn vai ...","Minh Vy"
54813,"NỖI NHỚ THEO MÀN MƯA","Ngoài trời mưa vẫn rơi như bức tranh...","Bảo Thạch"
54810,"NHỮNG CÁNH CHIM MƠ ƯỚC","Những cánh chim mơ ước đang về...","Phạm Thế Mỹ"
54811,"NÍU KÉO LÀ ĐỚN ĐAU","Cuộc tình nồng nàn mà anh đã trao em...","Minh Nhiên"
54816,"NƯỚC MẮT PHÔI PHA (BABY, PLEASE COME BACK)","Người có nhớ đến những khi vai kề vai người có nhớ đến phút giây...","Nguyễn Hoàng Duy"
54817,"PHONG NHA HUYỀN ẢO","Phong Nha ơi Phong Nha mây kết ngẩn ngơ...","Nhạc: Lê Anh, Thơ: Hoàng Vũ Thuật"
54814,"NỤ HÔN CUỐI CÙNG","Chờ mong về nơi xa ấy, có khi nào anh về trong giấc mơ...","Tường Văn"
54815,"NỤ HÔN DẤU YÊU","Màn đêm buông lơi, ngàn sao lấp lánh trên trời...","Quốc An"
54819,"PHÚT GIÂY","Này người yêu ơi anh có nhớ không...","Yên Lam"
54818,"PHỐ NÚI TÌNH YÊU","Bao năm đi xa anh trở về đây anh đang ngơ ngác giữa lòng phố lạ...","Nhạc: Đức Trịnh, Thơ: Hà Thu"
54820,"QUA CẦU NHẬT LỆ","Về với quê anh qua cầu Nhật Lệ, Bảo Ninh đây rồi chẳng lụy đò đưa...","Lê Anh"
54821,"ROCK VẦNG TRĂNG","Một bầu trời rực sáng soi ánh trăng lòng ngập tràn...","Trần Thanh Tùng"
54822,"ROCK VỚI TÔI (ROCK WITH ME)","Quên đi mau những khó khăn ngày qua, ta bay cao với ước mơ...","Lâm Quốc Cường"
54823,"SAO MÀ LẠ GHÊ","Bé hát thật to bé thưa lại nhỏ sao mà lạ ghê...","Lê Quốc Thắng"
54824,"SAO PHA LÊ","Lấp lánh những ánh sao lung linh...","Nam Cường"
54825,"SẼ MÃI KHÔNG THÀNH","Thời gian em đến bên anh cho anh đam mê một trời yêu dấu...","Duy Mạnh"
54826,"SÓNG RU","Chiều nay sóng xô bờ chiều nay em nhớ anh...","Nguyễn Ngọc Tài"
54827,"SỢ RẰNG EM NHỚ AI","Từng chiều con đường ngập nắng xưa đôi ta vẫn thường mơ...","Bằng Cường"
54828,"SỰ THẬT MỘT GIẤC MƠ","Đêm nay không có em... Đêm nay không còn anh bên cạnh em...","Phạm Trưởng"
54803,"NHẢY LÒ CÒ","Nhảy lò cò nhảy lò cò chân em bước nhịp nhịp nhàng từng ô...","Lê Quốc Thắng"
54804,"NHỊP ĐIỆU TUỔI THƠ","Da da da... Nhịp điệu tuổi thơ ngân vang lên rộn ràng bao trái tim...","Nguyễn Hiệp"
54805,"NHỚ CON","Hạt mưa rơi tí tách ngoài hiên, mùa đông sang cơn gió lạnh căm...","Lê Thị Ni Ni"
54806,"NHỚ EM","Những phút giây nào... Đã biết bao chiều, đã nhớ thương nhiều...","Nhật Đăng"
54800,"NGÔI SAO CÒN LẠI","Có những lúc anh thường hay nằm mơ anh và em chung sống...","Minh Khang"
54801,"NGƯỜI HÃY HỨA VỚI TÔI","Ngồi một mình dưới trăng lạnh lùng, mây xám đang bay về...","Minh Vy"
54802,"NGUYỆN THỀ ĐÊM ĐÔNG","Bao nhiêu năm qua rồi con tim em lạnh lùng...","Trương Lê Sơn"
54857,"VIẾT CHO NGƯỜI Ở XA","Ngày anh đi lá thu nhẹ rơi gió cứ như lặng yên...","Yên Lam"
54856,"VÌ ANH ĐÃ YÊU EM","Hờn ghen chi hỡi người qua thời thơ dại...","Vĩnh Tâm"
54855,"VỀ VỚI THIÊN NHIÊN","Em đi lên rừng băng qua con suối sâu nghe tiếng chim rộn vang...","Hoàng Vũ"
54854,"VỀ NƠI BÌNH YÊN","Ngàn khơi vắng xa bờ cát êm đềm...","Thành Vương"
54859,"VÔ VỌNG","Có những lúc em muốn hy vọng...","Tường Văn"
54858,"VÔ CÙNG","Dù ước muốn hôm nào bây giờ hóa thành mây...","Vũ Quốc Việt"
54853,"VỀ ĐÂU","Như con chim non đang đi tìm tổ, em vẫn tìm trong cơn mưa đêm...","Chu Lê Minh"
54852,"VẼ TRÁI TIM","Vẽ trái tim anh mang tặng em món quà kiếm cớ vu vơ...","Quang Vinh"
54851,"VẼ LẠI PHÚT GIÂY ANH GẶP EM","Hạnh phúc đôi khi trong cuộc đời ta không biết...","Nhất Trung"
54850,"VẺ VANG LỤC QUÂN 2","Những bước đi làm nên chiến thắng...","Minh Quang"
54866,"AI YÊU KHÔNG KHỔ VÌ YÊU","Tôi muốn bắc thang lên hỏi ông trời...","Đình Văn"
54865,"YÊU THƯƠNG CÒN ĐÂY","Chờ anh trong mỏi mòn, một tình yêu dẫu có còn...","Quang Đức"
54868,"ANH ĐÃ VỘI QUÊN","Na na na... Còn nhớ những lúc khi xưa...","Huỳnh Nhật Tân"
54867,"ANH","Anh tựa bài thơ không chép được...","Nguyễn Cường - Chu Hoạch"
54869,"ANH KHÔNG MUỐN NÓI LỜI TỪ BIỆT","Ước mong rằng mình mãi gần nhau...","Ngọc Sơn"
54860,"VỠ TAN","Từng giọt mưa rơi bên hiên vắng ngắt, từng ngày trôi qua...","Võ Mạnh Hiền"
54862,"XÍCH ĐU","Này em yêu ơi đến đây với anh thật gần...","Lương Bằng Quang"
54861,"VỸ DẠ ĐÒ TRĂNG","Một chiều tròn trăng, mái chèo ngược dòng chẳng hẹn mà nên...","Canh Thân"
54864,"YÊU EM","Chuyện tình yêu em với anh quá mong manh...","Lê Bá Vĩnh"
54863,"YÊU","Một sớm bình yên một ngày vui như đang đến gần...","Huy Tuấn"
54829,"TA ĐÃ XA NHAU","Từ khi em xa anh trái tim anh giờ đây giá băng...","Quang Mẫn"
54839,"TÌNH KHÚC THÁNG SÁU","Tháng sáu nhạt mưa, mưa ướt mềm vai em...","Nhạc: Ngô Thụy Miên, Thơ: Nguyên Sa"
54838,"TÌNH KHÚC CẦU HÔN","Đêm nay anh ngước lên trời cao...","Phan Đinh Tùng"
54837,"TÌNH CA HỒNG","Màn tóc lấp lánh như mưa thu xuống vây thân kín...","Quốc Bảo"
54836,"TÌM NHAU","Về nơi đâu em ơi khi con tim héo mòn...","Yên Lam"
54835,"TÌM LẠI MÁI TRANH XƯA","Bao kỷ niệm đẹp dưới mái nhà tranh...","Vy Chính"
54834,"TÌM","Có những khi ta buồn về đâu người ơi phía chân trời...","Hồng Ân"
54833,"TIẾNG KHÓC VE SẦU","Đau vùi ngủ đông những tháng ngày ôm nỗi chờ mong...","Điền Trọng Nguyên"
54832,"THỨ BA HỌC TRÒ","Nhất quỷ nhì ma... Ôi bao nhiêu yêu thương bên ngôi trường xưa...","Nguyễn Nhất Huy"
54831,"THỎA NỖI NHỚ MONG","Em ở đầu sông chứ riêng anh i i...","Dân ca quan họ Bắc Ninh"
54830,"THÀ ANH NÓI","Đã hết rồi người ơi vầng trăng đã không còn soi bóng ...","Lư Anh"
54848,"TUỔI 13","Trời hôm nay mưa nhiều hay rất nắng...","Nhạc: Ngô Thụy Miên, Thơ: Nguyên Sa"
54847,"TỤI NÓ","Tụi nó với tôi những thằng bạn thân từ thuở ấu thơ...","Minh Vy"
54849,"VẪN HÁT VỀ ANH","Đêm về khuya lấp lánh ánh sao như muôn lời thơ...","Nguyễn Đức Cường"
54844,"TRĂNG TRONG PHỐ","Nơi về đêm mặt trăng ló, vầng trăng sáng lấp lánh...","Huy Tuấn"
54843,"TRĂNG KHÔNG TRÒN","Tình yêu ngày xưa đắm đuối mộng mơ...","Minh Khang"
54846,"TRÔNG MONG CHI NGƯỜI ĐÃ RA ĐI","Giật mình tỉnh giấc trong đêm nhìn quanh không tìm ra bóng em...","Nguyễn Hoàng"
54845,"TRÊN SÂN GA","Về nơi đâu người ơi có hay chăng tình tôi còn yêu em đậm sâu...","Đỗ Đình Phúc"
54840,"TÌNH MỚI","Tình yêu mới đã mang anh đi về bên ấy trong tầm tay người...","Kỳ Phương"
54842,"TÌNH YÊU CAO THƯỢNG","Ngàn vì sao đêm nay không còn sáng cho riêng đôi mình...","Hamlet Trương"
54841,"TÌNH TA BIỂN BẠC ĐỒNG XANH","Thuyền anh ra khơi khi chân mây ửng hồng...","Hoàng Sông Hương"
50500,"DUYÊN HẢI BIỂN QUÊ TÔI","Hò ớ dô.. Biển xanh quê tôi...","Phạm Minh Tuấn"
50501,"BÊN NHAU NGÀY VUI","Một sớm tan trường tà áo trắng ngập đường...","Quốc Dũng"
50504,"BẾN THƯỢNG HẢI","Biển sóng dạt dào...","Nhạc Hoa"
50505,"CHUYỆN TÌNH HOA BƯỚM","Nghe lá thu rơi bên thềm...","Thanh Sơn"
50502,"ĐÀ LẠT HOÀNG HÔN","Lắng nghe chiều xuống...","Nhạc: Minh Kỳ, Lời: Dạ Cầm"
50503,"DÁNG EM","Ngoài kia bao nhiêu câu ca...","Nguyễn Văn Thanh Nhã"
54894,"BÊN TRỜI QUẠNH HIU","Ngày ấy bước bên nhau trên đồi thanh vắng...","Quốc Dũng"
54895,"BẾN ĐÀN XUÂN","Lênh đênh theo gió hồn về đâu, chơi vơi trong khúc nhạc...","Ngọc Bích"
54896,"BIỂN CHỜ","Tôi vẫn chờ nghe biển trôi âm thầm...","Bảo Chấn"
54897,"BIỂN TÌNH","Nằm nghe sóng vỗ từng lớp xa...","Lam Phương"
54890,"BẬU ĐI THEO NGƯỜI","Em người ở đất miền Tây, ai xui em đến chốn này gặp tôi...","Nguyễn Ngọc Thạch"
54891,"BÉ YÊU (BABY BÉ YÊU)","Những chiếc lá rơi khi mùa đã sang...","Thanh Hà"
54892,"BÊN EM CHIỀU MƯA","Chiều nay ta sánh vai, trên phố mưa rơi mịt mù...","Trường Huy"
54893,"BÊN NGƯỜI NÀY NHỚ NGƯỜI KIA","Lâu nay tình yêu của anh xẻ đôi...","Bảo Chinh"
54898,"BÌNH YÊN Ở LẠI","Chớ giận hờn và chớ vô tình...","Nguyễn Đức Trung"
54899,"BÓNG CỜ LAU","Ta cùng nhau đi thăm nơi hùng xưa...","Hoàng Quý"
54881,"BÀI CA ĐÊM","Rồi đêm sẽ qua, cuộc vui cũng qua, em vẫn bên anh...","Bảo Chấn"
54882,"BÀI CA SUM HỌP","Đây những bầy chim xinh tung cánh bay về thành phố...","Phong Nhã"
54880,"BÀ ƠI ĐI CHỢ","Con gà cục tác lá chanh lá chanh, con lợn ủn ỉn...","Nhạc: Lương Bằng Vinh, Lời: Đồng dao"
51698,"LÝ QUA CẦU 2 ","Cầu tre dẫn lối xe duyên mình tơ hồng chỉ thắm...","Cổ nhạc: Thanh Liêm, Tân nhạc: Dân ca"
54885,"BÃO TUYẾT","Từng chiếc lá úa rơi cuối thu mỏng manh...","Lê Bá Vĩnh"
51697,"LÝ QUA CẦU 1 ","Cầu tre dẫn lối xe duyên mình tơ hồng chỉ thắm...","Cổ nhạc: Thanh Liêm, Tân nhạc: Dân ca"
54886,"BAY CÙNG TÌNH YÊU","Ngày xưa anh vẫn thường mơ về một điều lạ vu vơ...","Lương Bằng Quang"
54883,"BÀI CA TẶNG EM","Anh mang thêm năm chiếc nón mới...","Đỗ Quang"
51699,"KHỔ THÂN GIÀ 1 ","Vợ một thì nằm giường lèo vợ hai co rút...","Quy Sắc"
54884,"BAN MAI XANH","Với ước mơ về phía mặt trời xanh...","Ngọc Châu"
51694,"MƯA BỤI 2 ","Ngày của đôi ta đã theo mưa bụi nhòa...","Cổ nhạc: Huỳnh Nguyên, Tân nhạc: Hữu Minh"
54889,"BẮT ĐẦU VÀ KẾT THÚC","Em vui bên ai, anh niềm đau bắt đầu...","Điền Trọng Nguyên"
51693,"MƯA BỤI 1 ","Ôm ấp tình yêu kỷ niệm còn đây...","Cổ nhạc: Huỳnh Nguyên, Tân nhạc: Hữu Minh"
51696,"LÝ CHIỀU CHIỀU 2 ","Tình yêu tháng ngày kết xe tơ hồng...","Cổ nhạc: Hoa Trang Nhã, Tân nhạc: Dân ca"
54887,"BAY TRÊN NHỮNG GIẤC MƠ","Đêm qua ngủ quên giữa trời, ta bay vào trong thế giới...","Tuấn Khanh"
51695,"LÝ CHIỀU CHIỀU 1 ","Chiều chiều ra đứng Tây lầu Tây...","Cổ nhạc: Hoa Trang Nhã, Tân nhạc: Dân ca"
54888,"BAY VÀO NGÀY XANH","Con chim nghiêng nghiêng trong nắng...","Dương Thụ"
51690,"CHỊ TÔI 2 ","Rồi một đêm sáng trăng...","Cổ nhạc: Huỳnh Nguyên, Tân nhạc: Trần Tiến"
51692,"ĐỪNG TRÁCH ĐA ĐA 2 ","Ai làm ai làm cho giọt mưa tuôn...","Cổ nhạc: Viễn Châu, Tân nhạc: Võ Đông Điền"
51691,"ĐỪNG TRÁCH ĐA ĐA 1 ","Rồi con chim đa đa ngẩn ngơ đứng...","Cổ nhạc: Viễn Châu, Tân nhạc: Võ Đông Điền"
54870,"ANH NHỚ VỀ THĂM MẸ","Dẫu xa xôi anh nhớ về thăm mẹ...","Nhạc: Nguyễn Hữu Thiết, Lời: Bích Liên"
54871,"ANH SẼ CỐ GẮNG HƠN","Em hỏi anh, anh vẫn yêu em phải không...","Duy Mạnh"
51689,"CHỊ TÔI 1 ","Nhà tôi trên bến sông...","Cổ nhạc: Huỳnh Nguyên, Tân nhạc: Trần Tiến"
54872,"ANH VẪN ĐỢI CHỜ","Nhìn lá bay mùa thu dịu êm, lòng nhớ em anh thầm gọi tên...","Hoài An"
51688,"XIN ĐỪNG QUÊN TÔI (FORGET ME NOT)","For get me not, for for get for get me not...","Quốc An"
54873,"ANH VỀ GIỮA MÙA XUÂN","Muôn chim đua hót chào, nắng xuân huy hoàng...","Quốc Dũng"
51687,"YÊU LẦM","Tim thôi buồn đau...","Nhạc Hoa, Lời Việt: Minh Kha"
54874,"ANH XIN LỖI (ANH SORRY)","Ngày đó ta gặp nhau, một thời tuổi thơ mình đã trao về nhau...","Thái Thịnh"
51686,"VẪN YÊU MỘT MÌNH","Có một người vừa hé...","Nguyễn Ngọc Thạch"
54875,"ÁNH TRĂNG Ở BÊN EM","Ngày trôi qua mau để đêm tới, trăng sẽ lên cao và kề bên...","Bảo Thạch"
51685,"TUỔI 18","Tuổi mười tám lấp lánh...","Nguyễn Văn Hiên"
54876,"AO CÁ ĐỢI CHỜ","Anh tiếc cái công lao anh đào ao thả cá...","Hoàng Thắng"
51684,"TRÁI TIM TÌNH SI","Ta đi tìm một trái tim...","Vũ Quốc Việt"
51683,"TRÁI TIM BUỒN","Người yêu hỡi có biết...","Quốc An"
54878,"ÁO TRẮNG","Bóng nắng loang nhanh trên con đường dài...","Vũ Quốc Bảo"
51682,"TƯƠNG TƯ","Từ chợ em ra về quanh co con đường quê...","Nhạc: Quốc An, Lời: Hoa Phương"
54879,"BA RU CON NGỦ","Đêm đang dần trôi, trời vẫn còn mưa, ba ru con ngủ à ơi...","Ngọc Lễ"
51681,"TÔI ĐI TÌM TÔI","Có những tối nghe mưa rơi...","Nguyễn Hoài Anh"
51680,"TÌNH TA LÝ QUA CẦU","Anh ở bên nay cầu...","Nhạc: Trương Quang Tuấn, Lời: Kim Tuấn"
51670,"THÀ RẰNG NHƯ THẾ","Cố giấu nước mắt lặng thầm nhìn nhau nghe nhói lòng...","Nguyễn Hoài Anh"
51671,"THƠ CHO CHỊ","Chị mười sáu tuổi theo chồng ...","Nhạc: Mai Thu Sơn, Lời: Sơn Trần"
50541,"DẬY MÀ ĐI","Dậy mà đi, dậy mà đi, ai chiến thắng không hề chiến bại...","Nguyễn Xuân Tân"
51672,"TÌNH ANH","Ngồi nhớ con phố ngày xưa, anh đón đưa em ...","Vũ Quốc Việt"
50540,"BÀI CA SINH VIÊN","Bài ca sinh viên ta hát...","Trần Hoàng Tiến"
51673,"TÌNH CUỒNG SAY","Có phải em là mây...","Hoàng Thái Châu"
51674,"TÌNH DẠI KHỜ","Em đã bước chân đi...","Nguyễn Nhất Huy"
51675,"TÌNH KHÔNG NGUÔI","Chiều xuống lưng đồi...","Chương Đức"
50545,"CÁCH XA","Anh về chi mấy ngày rồi lại đi biền biệt...","Phan Huỳnh Điểu"
51676,"TÌNH LỠ CÁCH XA","Một mùa thu qua...","Nhạc Hoa, Lời Việt: Trung Nghĩa"
50544,"DÁNG XUÂN","Nắng xuân đang rộn ràng...","Minh Châu"
51677,"TÌNH MẸ","Khẽ ngắt nụ hồng cài lên mái tóc xanh mẹ yêu ...","Nguyễn Nhất Huy"
50543,"GẶP NHAU TRONG MƯA","Một chiều tôi vừa đến...","Hồng Vân"
51678,"TÌNH MỘNG","Hãy cất tiếng hát vang lên một tình ca ...","Nguyễn Văn Thanh Nhã"
50542,"HỌC SINH HÀNH KHÚC","Học sinh là người tổ quốc...","Lê Thương"
51679,"TÌNH ƠI","Là la... Tình ơi tình xa tít mù...","Nguyễn Ngọc Thiện"
50549,"HÁT CHO DÂN TÔI NGHE","Hát cho dân tôi nghe...","Tôn Thất Lập"
50548,"HỌA SĨ TÍ HON","Màu vàng màu đen...","Mặc Tuân"
50547,"HẢI ÂU PHI XỨ","Dáng trăng tròn kìa sóng khua dồn...","Nhạc ngoại"
50546,"MÙA XUÂN TỪ NHỮNG GIẾNG DẦU","Hu ha ha... Mùa xuân đến từ...","Phạm Minh Tuấn"
50539,"BÊN KIA SÔNG","Hai bờ hai đứa ơi con sông dài...","Nguyễn Văn Hiên"
51662,"NỖI NHỚ","Bao hẹn thề giờ người...","Nguyễn Hoài Anh"
51663,"NÓI VỚI EM","Anh muốn nói yêu em...","Nguyễn Ngọc Thiện"
51660,"NGỌN LỬA TRÁI TIM","Hãy nhóm lên ngọn lửa...","Nguyễn Ngọc Thiện"
50530,"MƯỜI NĂM THƯƠNG NHỚ","Bất chợt một chiều...","Nguyễn Văn Hiên"
51661,"NHỚ GẤP NGÀN LẦN HƠN","Từ những năm tháng...","Trần Lê Quỳnh"
51666,"SẮC MÀU TÌNH YÊU","Một ngày tình cờ...","Nguyễn Ngọc Thạch"
50532,"MÙA THI NHỚ MÃI","Bạn ơi thấm thoát mùa thi...","Trương Quý Hải"
51667,"SÀI GÒN CHIỀU NGOẠI Ô","Bên kia dòng sông...","Vũ Hoàng"
50531,"DÁNG NGỌC","Trời trao cho em thướt tha dáng ngọc...","Nguyễn Ngọc Thiện"
51664,"ƯỚC MƠ","Hỡi ước mơ ơi cho ta làm cơn gió chiều...","Vũ Quốc Việt"
50534,"MỘT THỜI ÁO TRẮNG","Chợt gặp lại bao tà áo trắng...","Nguyễn Văn Hiên"
51665,"PHỐ NÚI CHIỀU XUÂN","Ta đưa nhau lên thành phố sương mù...","Nhạc: Sông Trà, Lời: Phương Hồng Nguyễn"
